{"$defs":{"definitionBinding":{"additionalProperties":false,"properties":{"definition_id":{"pattern":"^src0001-[a-z0-9][a-z0-9._-]*-v[0-9]+$","type":"string"},"path":{"pattern":"^product/contracts/src0001-apply/[a-z0-9][a-z0-9._-]*\\.json$","type":"string"},"sha256":{"pattern":"^[0-9a-f]{64}$","type":"string"}},"required":["definition_id","path","sha256"],"type":"object"}},"$id":"urn:securelinux-policy-v3:src0001-apply-composition:v1","$schema":"https://json-schema.org/draft/2020-12/schema","additionalProperties":false,"properties":{"apply_kind":{"const":"local-account-password-lock"},"architecture_binding":{"additionalProperties":false,"properties":{"architecture_id":{"const":"src0001-local-account-password-state-apply-modular-v1"},"path":{"const":"product/contracts/src0001-apply/architecture-v1.json"},"sha256":{"pattern":"^[0-9a-f]{64}$","type":"string"}},"required":["architecture_id","path","sha256"],"type":"object"},"check_population_authority_binding":{"additionalProperties":false,"properties":{"path":{"const":"product/contracts/local-account-password-state-check-semantic-v2.json"},"semantic_contract_id":{"const":"local-account-password-state-check-semantic-v2"},"sha256":{"const":"8351b4431f8f6ddd403afb4315cf2f8b5ebcf3f8d9c38f91bb3778e5086593cc"}},"required":["semantic_contract_id","path","sha256"],"type":"object"},"compatibility_chain":{"const":["check_population_authority","predicate","transform","object_identity","lock_reread","snapshot_precondition","metadata_preservation","atomic_transaction","dry_run_report","post_check_pass"]},"composition_contract_id":{"const":"local-account-password-state-apply-composition-v1"},"composition_contract_version":{"const":1},"contract_class":{"const":"APPLY_COMPOSITION"},"control_id":{"const":"FSTEC-LINUX-2022-2.1.1-LOCAL-ACCOUNT-PASSWORD-STATE"},"definition_bindings":{"additionalProperties":false,"properties":{"atomic_transaction":{"allOf":[{"$ref":"#/$defs/definitionBinding"}],"properties":{"definition_id":{"const":"src0001-shadow-atomic-transaction-v1"},"path":{"const":"product/contracts/src0001-apply/atomic-transaction-v1.json"}},"type":"object"},"dry_run_report":{"allOf":[{"$ref":"#/$defs/definitionBinding"}],"properties":{"definition_id":{"const":"src0001-dry-run-report-v1"},"path":{"const":"product/contracts/src0001-apply/dry-run-report-v1.json"}},"type":"object"},"lock_reread":{"allOf":[{"$ref":"#/$defs/definitionBinding"}],"properties":{"definition_id":{"const":"src0001-account-db-lock-reread-v1"},"path":{"const":"product/contracts/src0001-apply/lock-reread-v1.json"}},"type":"object"},"metadata_preservation":{"allOf":[{"$ref":"#/$defs/definitionBinding"}],"properties":{"definition_id":{"const":"src0001-shadow-metadata-preservation-v1"},"path":{"const":"product/contracts/src0001-apply/metadata-preservation-v1.json"}},"type":"object"},"object_identity":{"allOf":[{"$ref":"#/$defs/definitionBinding"}],"properties":{"definition_id":{"const":"src0001-shadow-object-identity-v1"},"path":{"const":"product/contracts/src0001-apply/object-identity-v1.json"}},"type":"object"},"predicate":{"allOf":[{"$ref":"#/$defs/definitionBinding"}],"properties":{"definition_id":{"const":"src0001-empty-second-shadow-field-predicate-v1"},"path":{"const":"product/contracts/src0001-apply/predicate-empty-second-shadow-field-v1.json"}},"type":"object"},"snapshot_precondition":{"allOf":[{"$ref":"#/$defs/definitionBinding"}],"properties":{"definition_id":{"const":"src0001-external-snapshot-precondition-v1"},"path":{"const":"product/contracts/src0001-apply/snapshot-precondition-v1.json"}},"type":"object"},"transform":{"allOf":[{"$ref":"#/$defs/definitionBinding"}],"properties":{"definition_id":{"const":"src0001-empty-second-shadow-field-to-bang-transform-v1"},"path":{"const":"product/contracts/src0001-apply/transform-empty-second-shadow-field-to-bang-v1.json"}},"type":"object"}},"required":["predicate","transform","snapshot_precondition","lock_reread","object_identity","metadata_preservation","atomic_transaction","dry_run_report"],"type":"object"},"parent_contract_binding":{"additionalProperties":false,"properties":{"path":{"const":"product/contracts/local-account-password-state-apply-semantic-v1.json"},"semantic_contract_id":{"const":"local-account-password-state-apply-semantic-v1"},"sha256":{"const":"48e008ac5cd7da8e17dac3f5cef556cb9def3ba36051e4623bc2255ca3c312be"}},"required":["semantic_contract_id","path","sha256"],"type":"object"},"postcondition":{"additionalProperties":false,"properties":{"check_contract_id":{"const":"local-account-password-state-check-semantic-v2"},"idempotent_reapply":{"const":"NO_MUTATION"},"required_compliance":{"const":"PASS"}},"required":["check_contract_id","required_compliance","idempotent_reapply"],"type":"object"},"source_row":{"const":"SRC-0001"},"target_class":{"const":"shadow-password-field"}},"required":["composition_contract_id","composition_contract_version","contract_class","source_row","control_id","apply_kind","target_class","architecture_binding","parent_contract_binding","check_population_authority_binding","definition_bindings","compatibility_chain","postcondition"],"title":"SecureLinux-Policy-v3 SRC-0001 APPLY composition v1","type":"object"}
