{"apply_kind":"local-account-password-lock","architecture_binding":{"architecture_id":"src0001-local-account-password-state-apply-modular-v1","path":"product/contracts/src0001-apply/architecture-v1.json","sha256":"f11f7485821dca7682e6bc669ddc095b9fd61647808cb9018bd553aa96810531"},"check_population_authority_binding":{"path":"product/contracts/local-account-password-state-check-semantic-v2.json","semantic_contract_id":"local-account-password-state-check-semantic-v2","sha256":"8351b4431f8f6ddd403afb4315cf2f8b5ebcf3f8d9c38f91bb3778e5086593cc"},"compatibility_chain":["check_population_authority","predicate","transform","object_identity","lock_reread","snapshot_precondition","metadata_preservation","atomic_transaction","dry_run_report","post_check_pass"],"composition_contract_id":"local-account-password-state-apply-composition-v1","composition_contract_version":1,"contract_class":"APPLY_COMPOSITION","control_id":"FSTEC-LINUX-2022-2.1.1-LOCAL-ACCOUNT-PASSWORD-STATE","definition_bindings":{"atomic_transaction":{"definition_id":"src0001-shadow-atomic-transaction-v1","path":"product/contracts/src0001-apply/atomic-transaction-v1.json","sha256":"a171356ea7521e52be5883cff8f785ac12a95857b5e950094aa615e0472e5ee4"},"dry_run_report":{"definition_id":"src0001-dry-run-report-v1","path":"product/contracts/src0001-apply/dry-run-report-v1.json","sha256":"aa9e57dc2533fa95b4e2de87f8ba9aeec098b7bf5b439fbb96c6645b44a7eaaf"},"lock_reread":{"definition_id":"src0001-account-db-lock-reread-v1","path":"product/contracts/src0001-apply/lock-reread-v1.json","sha256":"d37a252ccdc60444369a9949e5b34d35203949efa9d214c77559ee60a8b8c328"},"metadata_preservation":{"definition_id":"src0001-shadow-metadata-preservation-v1","path":"product/contracts/src0001-apply/metadata-preservation-v1.json","sha256":"b380cb242f8b4141301cc196b5f2abf4e09373b90886ac94a7dcd8d899fb990c"},"object_identity":{"definition_id":"src0001-shadow-object-identity-v1","path":"product/contracts/src0001-apply/object-identity-v1.json","sha256":"ae4c372d296871d43d513b09f9dd5d6ac30c8387adc032a877ab163cea59185a"},"predicate":{"definition_id":"src0001-empty-second-shadow-field-predicate-v1","path":"product/contracts/src0001-apply/predicate-empty-second-shadow-field-v1.json","sha256":"9e531762d11504f4832a5ea8bb736ea63d5720b92ec2f15f3055018eddaf81ec"},"snapshot_precondition":{"definition_id":"src0001-external-snapshot-precondition-v1","path":"product/contracts/src0001-apply/snapshot-precondition-v1.json","sha256":"4ce1dd93c27dcdf112c7de9b8b6b4bfbd5456f0085d4c86ddb9130233cd2991a"},"transform":{"definition_id":"src0001-empty-second-shadow-field-to-bang-transform-v1","path":"product/contracts/src0001-apply/transform-empty-second-shadow-field-to-bang-v1.json","sha256":"606d5c68824bcfd09a209966e2c2e60210df83f105ad36592211e2a1ddd5b9bc"}},"parent_contract_binding":{"path":"product/contracts/local-account-password-state-apply-semantic-v1.json","semantic_contract_id":"local-account-password-state-apply-semantic-v1","sha256":"48e008ac5cd7da8e17dac3f5cef556cb9def3ba36051e4623bc2255ca3c312be"},"postcondition":{"check_contract_id":"local-account-password-state-check-semantic-v2","idempotent_reapply":"NO_MUTATION","required_compliance":"PASS"},"source_row":"SRC-0001","target_class":"shadow-password-field"}
